{"authority":["test-owned component map"],"components":[{"component_id":"results","component_type":"artifact","elements":[{"element_id":"accuracy","evidence":[{"locator":"lines:1-1","observed":"Synthetic reviewer notes the descriptive context.","source":"evidence/context.txt"},{"locator":"lines:1-1","observed":"The sample describes the metric without a reliability conclusion.","source":"evidence/context.txt"},{"locator":"lines:1-1","observed":"The stored sample reports accuracy 0.70 on held-out samples.","source":"evidence/counter.txt"},{"locator":"lines:1-1","observed":"The stored sample reports accuracy 0.91.","source":"evidence/support.txt"}],"target":"reported accuracy"}]}],"objective":"Provide a bounded structural authority for recorder tests.","scope":["focused evidence-bound recorder fixture"]}
